{
  "$schema": "./schema.json",
  "schema_version": "1.0",
  "dataset_name": "underwriting_conversation_eval",
  "dataset_version": "v1",
  "evaluation_date": "2026-09-07",
  "split": "holdout",
  "source_catalog": "sources.json",
  "review_status": "machine_authored_source_checked_pending_human_review",
  "execution_status": "not_run",
  "fixtures": {
    "lt_complex": {
      "quality": "verified_reference",
      "provenance": "Synthetic source-checked fixture; not an observed production prompt.",
      "history": [
        {
          "turn_id": "lt_complex:t0",
          "question": "What evidence is required for Independent / Complex income in LumenTrail V1?",
          "answer": "For LumenTrail V1 Independent / Complex income, provide four recent bank statements unless an approved automated source supplies twelve months of consistent inflow history. A business-income summary and attestation are also required. [LumenTrail_UW_V1_pdf.pdf::0018]",
          "scope": {
            "lender_id": "lumentrail",
            "document_version": "V1"
          },
          "context_source_refs": [
            "lt1_income_docs"
          ]
        }
      ]
    },
    "lt_complex_faulty": {
      "quality": "deliberately_incorrect",
      "provenance": "Synthetic source-checked fixture; not an observed production prompt.",
      "history": [
        {
          "turn_id": "lt_complex_faulty:t0",
          "question": "What evidence is required for Independent / Complex income in LumenTrail V1?",
          "answer": "Only three statements are required and no automated-history exception exists. [LumenTrail_UW_V1_pdf.pdf::0018]",
          "scope": {
            "lender_id": "lumentrail",
            "document_version": "V1"
          },
          "context_source_refs": [
            "lt1_income_docs"
          ]
        }
      ]
    },
    "lt_complex_missing": {
      "quality": "verified_reference",
      "provenance": "Synthetic source-checked fixture; not an observed production prompt.",
      "history": [
        {
          "turn_id": "lt_complex_missing:t0",
          "question": "What evidence is required for Independent / Complex income in LumenTrail V1?",
          "answer": "For LumenTrail V1 Independent / Complex income, provide four recent bank statements unless an approved automated source supplies twelve months of consistent inflow history. A business-income summary and attestation are also required. [LumenTrail_UW_V1_pdf.pdf::0018]",
          "scope": {
            "lender_id": "lumentrail",
            "document_version": "V1"
          },
          "context_source_refs": []
        }
      ]
    },
    "lt_device": {
      "quality": "verified_reference",
      "provenance": "Synthetic source-checked fixture; not an observed production prompt.",
      "history": [
        {
          "turn_id": "lt_device:t0",
          "question": "What does LumenTrail V1 Shared Device Cluster mean?",
          "answer": "Code 114 requires Specialist Review. Legitimate household/shared-network use can be reconciled using relationship, identity consistency, timing and funding ownership. [LumenTrail_UW_V1_pdf.pdf::0043]",
          "scope": {
            "lender_id": "lumentrail",
            "document_version": "V1"
          },
          "context_source_refs": [
            "lt1_device"
          ]
        }
      ]
    },
    "lt_flow0": {
      "quality": "verified_reference",
      "provenance": "Synthetic source-checked fixture; not an observed production prompt.",
      "history": [
        {
          "turn_id": "lt_flow0:t0",
          "question": "Which comes first after Verified Partner Eligibility in LumenTrail V0: preliminary line calculation or enhanced fraud review?",
          "answer": "Calculate the preliminary line first, then enhanced fraud review, then final underwriting checks. A pass is continuation, not funding approval. [LumenTrail_UW_V0_pdf.pdf::0025]",
          "scope": {
            "lender_id": "lumentrail",
            "document_version": "V0"
          },
          "context_source_refs": [
            "lt0_flow"
          ]
        }
      ]
    },
    "lt_identity0": {
      "quality": "verified_reference",
      "provenance": "Synthetic source-checked fixture; not an observed production prompt.",
      "history": [
        {
          "turn_id": "lt_identity0:t0",
          "question": "When does identity-document validity trigger Code 128 in LumenTrail V0?",
          "answer": "Evidence Required 128 applies when evidence expires before expected funding. [LumenTrail_UW_V0_pdf.pdf::0029]",
          "scope": {
            "lender_id": "lumentrail",
            "document_version": "V0"
          },
          "context_source_refs": [
            "lt0_dictionary"
          ]
        }
      ]
    },
    "lt_notice": {
      "quality": "verified_reference",
      "provenance": "Synthetic source-checked fixture; not an observed production prompt.",
      "history": [
        {
          "turn_id": "lt_notice:t0",
          "question": "What does LumenTrail V1 Code 133 mean?",
          "answer": "It is a Funding Hold Operational Notice: funding is paused while a separate evidence or review result remains open. The notice alone does not state approval or decline. [LumenTrail_UW_V1_pdf.pdf::0031] [LumenTrail_UW_V1_pdf.pdf::0048]",
          "scope": {
            "lender_id": "lumentrail",
            "document_version": "V1"
          },
          "context_source_refs": [
            "lt1_notice_dictionary",
            "lt1_notices"
          ]
        }
      ]
    },
    "lt_reopen1": {
      "quality": "verified_reference",
      "provenance": "Synthetic source-checked fixture; not an observed production prompt.",
      "history": [
        {
          "turn_id": "lt_reopen1:t0",
          "question": "Can a reopened LumenTrail V1 case reuse still-valid identity and funding-ownership evidence?",
          "answer": "V1 requires both identity and funding-ownership evidence to be refreshed even if still ordinarily valid. Preserve the earlier disposition and start a new evaluation event. [LumenTrail_UW_V1_pdf.pdf::0040]",
          "scope": {
            "lender_id": "lumentrail",
            "document_version": "V1"
          },
          "context_source_refs": [
            "lt1_reopen"
          ]
        }
      ]
    },
    "lt_roles_old": {
      "quality": "verified_reference",
      "provenance": "Synthetic source-checked fixture; not an observed production prompt.",
      "history": [
        {
          "turn_id": "lt_roles_old:t0",
          "question": "Does a Household Contributor become a borrower at LumenTrail V1?",
          "answer": "No. A documented contribution may support residual-income analysis, but the contributor is not an obligor and cannot satisfy borrower identity controls. [LumenTrail_UW_V1_pdf.pdf::0004]",
          "scope": {
            "lender_id": "lumentrail",
            "document_version": "V1"
          },
          "context_source_refs": [
            "lt1_roles"
          ]
        },
        {
          "turn_id": "lt_roles_old:t1",
          "question": "What does LumenTrail V1 Code 133 mean?",
          "answer": "It is a Funding Hold Operational Notice: funding is paused while a separate evidence or review result remains open. The notice alone does not state approval or decline. [LumenTrail_UW_V1_pdf.pdf::0031] [LumenTrail_UW_V1_pdf.pdf::0048]",
          "scope": {
            "lender_id": "lumentrail",
            "document_version": "V1"
          },
          "context_source_refs": [
            "lt1_notice_dictionary",
            "lt1_notices"
          ]
        },
        {
          "turn_id": "lt_roles_old:t2",
          "question": "How does LumenTrail V1 handle reopened cases?",
          "answer": "V1 requires both identity and funding-ownership evidence to be refreshed even if still ordinarily valid. Preserve the earlier disposition and start a new evaluation event. [LumenTrail_UW_V1_pdf.pdf::0040]",
          "scope": {
            "lender_id": "lumentrail",
            "document_version": "V1"
          },
          "context_source_refs": [
            "lt1_reopen"
          ]
        },
        {
          "turn_id": "lt_roles_old:t3",
          "question": "What are the LumenTrail V1 Independent / Complex income documents?",
          "answer": "For LumenTrail V1 Independent / Complex income, provide four recent bank statements unless an approved automated source supplies twelve months of consistent inflow history. A business-income summary and attestation are also required. [LumenTrail_UW_V1_pdf.pdf::0018]",
          "scope": {
            "lender_id": "lumentrail",
            "document_version": "V1"
          },
          "context_source_refs": [
            "lt1_income_docs"
          ]
        }
      ]
    },
    "nc_current_selection": {
      "quality": "verified_reference",
      "provenance": "Synthetic source-checked fixture; not an observed production prompt.",
      "history": [
        {
          "turn_id": "nc_current_selection:t0",
          "question": "What monthly Income Proxy is required for NovaCred current Prescreen selection?",
          "answer": "NovaCred V1 requires an Income Proxy of at least $2,100 monthly, from NovaCred Affordability Index. [NovaCred_UW_V1_pdf.pdf::0003]",
          "scope": {
            "lender_id": "novacred",
            "document_version": "V1"
          },
          "context_source_refs": [
            "nc1_selection"
          ]
        }
      ]
    },
    "nc_exposure": {
      "quality": "verified_reference",
      "provenance": "Synthetic source-checked fixture; not an observed production prompt.",
      "history": [
        {
          "turn_id": "nc_exposure:t0",
          "question": "What is the existing-exposure ceiling in NovaCred V0 Prescreen selection?",